{
  "$schema": "./menu.schema.json",
  "versione": 1,
  "valuta": "EUR",
  "fonte": {
    "file": "menu.pdf",
    "pagineProdotti": [
      3,
      4,
      5,
      6
    ],
    "paginaAllergeni": 7
  },
  "noteAllergeni": "La pagina 7 riporta soltanto la legenda dei 14 allergeni, senza associazioni ai singoli prodotti. Le liste presenti nei prodotti sono indicative e non esaustive, dedotte dagli ingredienti e dalle preparazioni nominate; non sono dichiarazioni del ristorante. Vanno confermate con ricette e schede degli ingredienti. null indica informazione non disponibile, non assenza di allergeni. Nessun prodotto è attualmente verificato. Non usare questi dati per garantire l'idoneità a persone allergiche.",
  "noteMenu": [
    "*prodotto surgelato: nota presente a fondo pagina, senza un'associazione univoca alle singole voci."
  ],
  "costiAggiuntivi": {
    "coperto": {
      "nome": "Coperto",
      "prezzo": 2,
      "visibile": true,
      "paginaFonte": 6
    },
    "aggiuntePizze": {
      "descrizione": "Le aggiunte o le modifiche alle pizze possono subire variazione di € 1,00 o € 1,50.",
      "importi": [
        1,
        1.5
      ],
      "paginaFonte": 5
    }
  },
  "categorie": {
    "antipasti": {
      "nome": "Antipasti",
      "ordine": 10,
      "descrizione": ""
    },
    "frittura-della-casa": {
      "nome": "Frittura della Casa",
      "ordine": 20,
      "descrizione": ""
    },
    "insalate": {
      "nome": "Insalate",
      "ordine": 30,
      "descrizione": "Tutte le nostre insalate sono servite in coppa pane casereccio, cotto in forno a legna."
    },
    "primi-piatti": {
      "nome": "Primi Piatti",
      "ordine": 40,
      "descrizione": ""
    },
    "secondi-piatti": {
      "nome": "Secondi Piatti",
      "ordine": 50,
      "descrizione": ""
    },
    "pizze": {
      "nome": "Pizze",
      "ordine": 60,
      "descrizione": ""
    },
    "bevande": {
      "nome": "Bevande",
      "ordine": 70,
      "descrizione": ""
    },
    "dolci": {
      "nome": "Dolci",
      "ordine": 80,
      "descrizione": ""
    },
    "amari": {
      "nome": "Amari",
      "ordine": 90,
      "descrizione": ""
    }
  },
  "allergeni": {
    "arachidi": {
      "nome": "Arachidi e derivati",
      "ordine": 10
    },
    "frutta-a-guscio": {
      "nome": "Frutta a guscio",
      "ordine": 20
    },
    "latte": {
      "nome": "Latte e derivati",
      "ordine": 30
    },
    "molluschi": {
      "nome": "Molluschi",
      "ordine": 40
    },
    "pesce": {
      "nome": "Pesce",
      "ordine": 50
    },
    "sesamo": {
      "nome": "Sesamo",
      "ordine": 60
    },
    "soia": {
      "nome": "Soia",
      "ordine": 70
    },
    "crostacei": {
      "nome": "Crostacei",
      "ordine": 80
    },
    "glutine": {
      "nome": "Glutine",
      "ordine": 90
    },
    "lupini": {
      "nome": "Lupini",
      "ordine": 100
    },
    "senape": {
      "nome": "Senape",
      "ordine": 110
    },
    "sedano": {
      "nome": "Sedano",
      "ordine": 120
    },
    "solfiti": {
      "nome": "Anidride solforosa e solfiti",
      "ordine": 130
    },
    "uova": {
      "nome": "Uova e derivati",
      "ordine": 140
    }
  },
  "prodotti": {
    "antipasti-della-casa": {
      "categoria": "antipasti",
      "nome": "Antipasti della casa",
      "prezzo": 15,
      "prezzoMassimo": null,
      "prezzoAPersona": true,
      "prezzoSuRichiesta": false,
      "visibile": true,
      "descrizione": "10 portate.",
      "allergeni": null,
      "allergeniVerificati": false,
      "varianti": [],
      "ordine": 10,
      "paginaFonte": 3
    },
    "tagliere-salumi-formaggi": {
      "categoria": "antipasti",
      "nome": "Tagliere di salumi e formaggi locali",
      "prezzo": 10,
      "prezzoMassimo": null,
      "prezzoAPersona": true,
      "prezzoSuRichiesta": false,
      "visibile": true,
      "descrizione": "",
      "allergeni": [
        "latte"
      ],
      "allergeniVerificati": false,
      "varianti": [],
      "ordine": 20,
      "paginaFonte": 3
    },
    "tagliere-crudo-bufala": {
      "categoria": "antipasti",
      "nome": "Tagliere crudo e mozzarella di bufala",
      "prezzo": 12,
      "prezzoMassimo": null,
      "prezzoAPersona": false,
      "prezzoSuRichiesta": false,
      "visibile": true,
      "descrizione": "",
      "allergeni": [
        "latte"
      ],
      "allergeniVerificati": false,
      "varianti": [],
      "ordine": 30,
      "paginaFonte": 3
    },
    "tagliere-bresaola": {
      "categoria": "antipasti",
      "nome": "Tagliere bresaola, rucola e grana, olio evo, limone",
      "prezzo": 12,
      "prezzoMassimo": null,
      "prezzoAPersona": false,
      "prezzoSuRichiesta": false,
      "visibile": true,
      "descrizione": "",
      "allergeni": [
        "latte"
      ],
      "allergeniVerificati": false,
      "varianti": [],
      "ordine": 40,
      "paginaFonte": 3
    },
    "fave-verdura": {
      "categoria": "antipasti",
      "nome": "Fave e verdura di stagione",
      "prezzo": 9,
      "prezzoMassimo": null,
      "prezzoAPersona": false,
      "prezzoSuRichiesta": false,
      "visibile": true,
      "descrizione": "",
      "allergeni": null,
      "allergeniVerificati": false,
      "varianti": [],
      "ordine": 50,
      "paginaFonte": 3
    },
    "polpette-carne": {
      "categoria": "frittura-della-casa",
      "nome": "Polpette di carne",
      "prezzo": 6,
      "prezzoMassimo": null,
      "prezzoAPersona": false,
      "prezzoSuRichiesta": false,
      "visibile": true,
      "descrizione": "",
      "allergeni": null,
      "allergeniVerificati": false,
      "varianti": [],
      "ordine": 10,
      "paginaFonte": 3
    },
    "panzerottini": {
      "categoria": "frittura-della-casa",
      "nome": "Panzerottini",
      "prezzo": 5,
      "prezzoMassimo": null,
      "prezzoAPersona": false,
      "prezzoSuRichiesta": false,
      "visibile": true,
      "descrizione": "",
      "allergeni": [
        "glutine"
      ],
      "allergeniVerificati": false,
      "varianti": [],
      "ordine": 20,
      "paginaFonte": 3
    },
    "crocchette-patate": {
      "categoria": "frittura-della-casa",
      "nome": "Crocchette di patate",
      "prezzo": 6,
      "prezzoMassimo": null,
      "prezzoAPersona": false,
      "prezzoSuRichiesta": false,
      "visibile": true,
      "descrizione": "",
      "allergeni": null,
      "allergeniVerificati": false,
      "varianti": [],
      "ordine": 30,
      "paginaFonte": 3
    },
    "bocconcini-melanzane": {
      "categoria": "frittura-della-casa",
      "nome": "Bocconcini di melanzane",
      "prezzo": 5,
      "prezzoMassimo": null,
      "prezzoAPersona": false,
      "prezzoSuRichiesta": false,
      "visibile": true,
      "descrizione": "",
      "allergeni": null,
      "allergeniVerificati": false,
      "varianti": [],
      "ordine": 40,
      "paginaFonte": 3
    },
    "patatine-fritte": {
      "categoria": "frittura-della-casa",
      "nome": "Patatine fritte",
      "prezzo": 5,
      "prezzoMassimo": null,
      "prezzoAPersona": false,
      "prezzoSuRichiesta": false,
      "visibile": true,
      "descrizione": "",
      "allergeni": null,
      "allergeniVerificati": false,
      "varianti": [],
      "ordine": 50,
      "paginaFonte": 3
    },
    "pettole-verdura": {
      "categoria": "frittura-della-casa",
      "nome": "Pettole e verdura pastellata",
      "prezzo": 8,
      "prezzoMassimo": null,
      "prezzoAPersona": false,
      "prezzoSuRichiesta": false,
      "visibile": true,
      "descrizione": "",
      "allergeni": [
        "glutine"
      ],
      "allergeniVerificati": false,
      "varianti": [],
      "ordine": 60,
      "paginaFonte": 3
    },
    "insalata-acciughe-burrata": {
      "categoria": "insalate",
      "nome": "Insalata con acciughe e burrata",
      "prezzo": 12,
      "prezzoMassimo": null,
      "prezzoAPersona": false,
      "prezzoSuRichiesta": false,
      "visibile": true,
      "descrizione": "Insalata verde, rucola, pomodorini, olive leccine, acciughe, carciofi, burrata.",
      "allergeni": [
        "glutine",
        "pesce",
        "latte"
      ],
      "allergeniVerificati": false,
      "varianti": [],
      "ordine": 10,
      "paginaFonte": 3
    },
    "insalata-tonno-cacio-ricotta": {
      "categoria": "insalate",
      "nome": "Insalata con tonno e cacio ricotta",
      "prezzo": 11,
      "prezzoMassimo": null,
      "prezzoAPersona": false,
      "prezzoSuRichiesta": false,
      "visibile": true,
      "descrizione": "Insalata verde, rucola, pomodorini, tonno, cipolla, mix di verdurine caserecce in agrodolce e cacio ricotta.",
      "allergeni": [
        "glutine",
        "pesce",
        "latte"
      ],
      "allergeniVerificati": false,
      "varianti": [],
      "ordine": 20,
      "paginaFonte": 3
    },
    "insalata-bresaola-grana": {
      "categoria": "insalate",
      "nome": "Insalata con bresaola e grana",
      "prezzo": 13,
      "prezzoMassimo": null,
      "prezzoAPersona": false,
      "prezzoSuRichiesta": false,
      "visibile": true,
      "descrizione": "Insalata verde, rucola, pomodorini, bresaola, grana, limone, salsa di aceto balsamico.",
      "allergeni": [
        "glutine",
        "latte"
      ],
      "allergeniVerificati": false,
      "varianti": [],
      "ordine": 30,
      "paginaFonte": 3
    },
    "orecchietta-sugo": {
      "categoria": "primi-piatti",
      "nome": "Orecchietta al sugo",
      "prezzo": 9,
      "prezzoMassimo": null,
      "prezzoAPersona": false,
      "prezzoSuRichiesta": false,
      "visibile": true,
      "descrizione": "",
      "allergeni": [
        "glutine"
      ],
      "allergeniVerificati": false,
      "varianti": [],
      "ordine": 10,
      "paginaFonte": 4
    },
    "orecchiette-cime-rapa": {
      "categoria": "primi-piatti",
      "nome": "Orecchiette con cime di rapa",